<?xml version="1.0" encoding="UTF-8"?>
<template xmlns:vc="http://www.w3.org/2007/XMLSchema-versioning"
 xmlns="http://schema.amekoshi.com/2020/12/tmt/template"
 xmlns:abs="http://schema.amekoshi.com/2020/12/tmt/abstract"
 xmlns:xsi="http://www.w3.org/2001/XMLSchema-instance"
 xsi:schemaLocation="http://schema.amekoshi.com/2020/12/tmt/template file:/C:/Users/alan/PycharmProjects/sozu/schema/template.xsd">
    <author>R1YrkgLnZrqT</author>
    <id>ID000</id>
    <name>Jzlxdg38VEnvovx</name>
    <version>1809845359</version>
    <stencils>
        <stencil type="process" id="Bb43ffA0-ba0A-8edD-DB8F-aa4eEDA787bb">
            <abs:name>wwwoo</abs:name>
            <abs:description>W1bp-22YZYYnd.cVNCkjhm8kW</abs:description>
            <abs:image>696670877170668477856966888973788768879065837188</abs:image>
        </stencil>
        <stencil type="boundary" id="67C26fbE-86FD-D3F4-CAe8-CbAD9CCaBedC">
            <abs:name>P2P.2p_rPeyelfWp-tL.Qzfba_lKO36</abs:name>
            <abs:description>NEJQGyeO1Eihza</abs:description>
            <abs:image>678784778285738167896766747578817386848887836980707584897676676586716681</abs:image>
            <type>line</type>
        </stencil>
    </stencils>
    <ruleset>
        <rule stencil="Afdabaee-3DeC-7EfA-a8Ab-caf7f78b60De" threat="Bddde1d7-b36D-0CbA-BACa-2A16DfCfBAEf">
            <name>bQUGqZcwHsUl11rAc2gZMa395tXp.sThj1hA9Ic</name>
            <description>u6</description>
            <filter>gB_xelYNWl2Spn-FchD1OPX.GJv</filter>
        </rule>
        <rule stencil="CeBB9b2A-B71C-eae4-fDd0-FaDDeBC4Aabd" threat="D0AeaDBd-1BAa-e6D6-2Cfe-E0DfbFed3c0c">
            <name>Rjk1</name>
            <description>Zbeywwm3XhwDWMBTvId6Cvt_Xqtn-</description>
            <filter>p8</filter>
        </rule>
    </ruleset>
    <threats>
        <threat id="ED196F6F-AAeb-7FDc-CBCA-838DAeBeb96F">
            <name>kkbCpRDPpNL</name>
        </threat>
        <threat id="A7Bd2CF8-aCa9-2D3A-Ee35-08B49c8bFaac">
            <name>jwAN6jgHMS.</name>
        </threat>
    </threats>
</template>
